{
  "$schema": "https://json-schema.org/draft/2020-12/schema",
  "$id": "https://kryonix.org/schemas/install-plan-v2.schema.json",
  "title": "Kryonix Install Plan v2",
  "type": "object",
  "additionalProperties": false,
  "required": [
    "version",
    "isThinkServer",
    "repository",
    "storage",
    "features"
  ],
  "properties": {
    "version": {
      "type": "integer",
      "const": 2
    },
    "isThinkServer": {
      "type": "boolean"
    },
    "nodeThink": {
      "oneOf": [
        { "$ref": "#/$defs/nodeThinkPlan" },
        { "type": "null" }
      ]
    },
    "repository": {
      "$ref": "#/$defs/repositoryPlan"
    },
    "storage": {
      "$ref": "#/$defs/storagePlan"
    },
    "features": {
      "$ref": "#/$defs/features"
    },
    "network": {
      "oneOf": [
        {
          "$ref": "#/$defs/networkPlan"
        },
        {
          "type": "null"
        }
      ]
    }
  },
  "allOf": [
    {
      "description": "Frente 1: hostId obrigatorio apenas se algum volume usa ZFS",
      "if": {
        "properties": {
          "nodeThink": {
            "type": "object",
            "properties": {
              "enable": { "const": true }
            }
          },
          "storage": {
            "type": "object",
            "properties": {
              "root": {
                "type": "object",
                "properties": {
                  "filesystem": { "const": "zfs" }
                }
              }
            }
          }
        }
      },
      "then": {
        "required": ["nodeThink"],
        "properties": {
          "nodeThink": {
            "type": "object",
            "required": ["hostId"],
            "properties": {
              "hostId": { "type": "string", "minLength": 1 }
            }
          }
        }
      }
    },
    {
      "description": "Frente 1: hostId obrigatorio se data.filesystem = zfs (split topology)",
      "if": {
        "properties": {
          "nodeThink": {
            "type": "object",
            "properties": {
              "enable": { "const": true }
            }
          },
          "storage": {
            "type": "object",
            "properties": {
              "data": {
                "type": "object",
                "properties": {
                  "filesystem": { "const": "zfs" }
                }
              }
            }
          }
        }
      },
      "then": {
        "required": ["nodeThink"],
        "properties": {
          "nodeThink": {
            "type": "object",
            "required": ["hostId"],
            "properties": {
              "hostId": { "type": "string", "minLength": 1 }
            }
          }
        }
      }
    },
    {
      "description": "Frente 1: nodeThink.enable=true exige network.wan presente",
      "if": {
        "required": ["nodeThink"],
        "properties": {
          "nodeThink": {
            "type": "object",
            "required": ["enable"],
            "properties": {
              "enable": { "const": true }
            }
          }
        }
      },
      "then": {
        "required": ["network"],
        "properties": {
          "network": {
            "type": "object",
            "required": ["wan"],
            "properties": {
              "wan": { "type": "object" }
            }
          }
        }
      }
    }
  ],
  "$defs": {
    "repositoryPlan": {
      "type": "object",
      "additionalProperties": false,
      "required": [
        "coreUrl",
        "upstreamUrl",
        "downstreamUrl",
        "branch"
      ],
      "properties": {
        "coreUrl": {
          "type": "string",
          "format": "uri",
          "pattern": "^https://",
          "minLength": 9
        },
        "upstreamUrl": {
          "type": "string",
          "format": "uri",
          "pattern": "^https://",
          "minLength": 9
        },
        "downstreamUrl": {
          "type": "string",
          "format": "uri",
          "pattern": "^https://",
          "minLength": 9
        },
        "branch": {
          "type": "string",
          "minLength": 1
        }
      }
    },
    "mountPlan": {
      "type": "object",
      "additionalProperties": false,
      "required": [
        "filesystem",
        "encryption"
      ],
      "properties": {
        "filesystem": {
          "type": "string",
          "enum": [
            "btrfs",
            "zfs",
            "ext4",
            "xfs"
          ]
        },
        "encryption": {
          "type": "string",
          "enum": [
            "none",
            "luks2"
          ]
        }
      }
    },
    "zfsStoragePlan": {
      "type": "object",
      "additionalProperties": false,
      "required": [
        "userRefquota"
      ],
      "properties": {
        "userRefquota": {
          "type": "string",
          "pattern": "^[1-9][0-9]*(K|M|G|T|P)(i?B)?$",
          "examples": [
            "100G"
          ]
        }
      }
    },
    "btrfsStoragePlan": {
      "type": "object",
      "additionalProperties": false,
      "required": [
        "userQgroupLimit"
      ],
      "properties": {
        "userQgroupLimit": {
          "type": "string",
          "pattern": "^[1-9][0-9]*(K|M|G|T|P)(i?B)?$",
          "examples": [
            "100G"
          ]
        }
      }
    },
    "storagePlan": {
      "type": "object",
      "additionalProperties": false,
      "required": [
        "topology",
        "systemDisks",
        "dataDisks",
        "manualPartitions"
      ],
      "properties": {
        "topology": {
          "type": "string",
          "enum": [
            "single",
            "split",
            "raid",
            "manual"
          ]
        },
        "systemDisks": {
          "type": "array",
          "items": {
            "type": "string",
            "pattern": "^/dev/.+"
          },
          "uniqueItems": true
        },
        "dataDisks": {
          "type": "array",
          "items": {
            "type": "string",
            "pattern": "^/dev/.+"
          },
          "uniqueItems": true
        },
        "root": {
          "oneOf": [
            {
              "$ref": "#/$defs/mountPlan"
            },
            {
              "type": "null"
            }
          ]
        },
        "data": {
          "oneOf": [
            {
              "$ref": "#/$defs/mountPlan"
            },
            {
              "type": "null"
            }
          ]
        },
        "raidLevel": {
          "type": [
            "string",
            "null"
          ]
        },
        "manualPartitions": {
          "type": "array",
          "items": {
            "type": "string",
            "minLength": 1
          },
          "uniqueItems": true
        },
        "zfs": {
          "oneOf": [
            {
              "$ref": "#/$defs/zfsStoragePlan"
            },
            {
              "type": "null"
            }
          ]
        },
        "btrfs": {
          "oneOf": [
            {
              "$ref": "#/$defs/btrfsStoragePlan"
            },
            {
              "type": "null"
            }
          ]
        }
      },
      "allOf": [
        {
          "if": {
            "anyOf": [
              {
                "required": [
                  "root"
                ],
                "properties": {
                  "root": {
                    "type": "object",
                    "required": [
                      "filesystem"
                    ],
                    "properties": {
                      "filesystem": {
                        "const": "zfs"
                      }
                    }
                  }
                }
              },
              {
                "required": [
                  "data"
                ],
                "properties": {
                  "data": {
                    "type": "object",
                    "required": [
                      "filesystem"
                    ],
                    "properties": {
                      "filesystem": {
                        "const": "zfs"
                      }
                    }
                  }
                }
              }
            ]
          },
          "then": {
            "required": [
              "zfs"
            ],
            "properties": {
              "zfs": {
                "$ref": "#/$defs/zfsStoragePlan"
              }
            }
          }
        },
        {
          "if": {
            "required": [
              "data"
            ],
            "properties": {
              "data": {
                "type": "object",
                "required": [
                  "filesystem"
                ],
                "properties": {
                  "filesystem": {
                    "const": "btrfs"
                  }
                }
              }
            }
          },
          "then": {
            "required": [
              "btrfs"
            ],
            "properties": {
              "btrfs": {
                "$ref": "#/$defs/btrfsStoragePlan"
              }
            }
          }
        }
      ]
    },
    "featureSelection": {
      "type": "object",
      "additionalProperties": false,
      "patternProperties": {
        "^[A-Za-z0-9][A-Za-z0-9_-]*$": {
          "type": "boolean"
        }
      }
    },
    "features": {
      "type": "object",
      "additionalProperties": false,
      "patternProperties": {
        "^[A-Za-z0-9][A-Za-z0-9_-]*$": {
          "$ref": "#/$defs/featureSelection"
        }
      }
    },
    "managementNetwork": {
      "type": "object",
      "additionalProperties": false,
      "required": [
        "interface",
        "mode",
        "prefixLength",
        "hostname"
      ],
      "properties": {
        "interface": {
          "type": "string",
          "minLength": 1
        },
        "mode": {
          "type": "string",
          "enum": [
            "dhcp",
            "static"
          ]
        },
        "address": {
          "oneOf": [
            {
              "type": "string",
              "pattern": "^(25[0-5]|2[0-4]\\d|[01]?\\d?\\d)\\.(25[0-5]|2[0-4]\\d|[01]?\\d?\\d)\\.(25[0-5]|2[0-4]\\d|[01]?\\d?\\d)\\.(25[0-5]|2[0-4]\\d|[01]?\\d?\\d)$"
            },
            {
              "type": "null"
            }
          ]
        },
        "prefixLength": {
          "type": "integer",
          "minimum": 1,
          "maximum": 32
        },
        "gateway": {
          "oneOf": [
            {
              "type": "string",
              "pattern": "^(25[0-5]|2[0-4]\\d|[01]?\\d?\\d)\\.(25[0-5]|2[0-4]\\d|[01]?\\d?\\d)\\.(25[0-5]|2[0-4]\\d|[01]?\\d?\\d)\\.(25[0-5]|2[0-4]\\d|[01]?\\d?\\d)$"
            },
            {
              "type": "null"
            }
          ]
        },
        "dns": {
          "type": "array",
          "items": {
            "type": "string",
            "pattern": "^(25[0-5]|2[0-4]\\d|[01]?\\d?\\d)\\.(25[0-5]|2[0-4]\\d|[01]?\\d?\\d)\\.(25[0-5]|2[0-4]\\d|[01]?\\d?\\d)\\.(25[0-5]|2[0-4]\\d|[01]?\\d?\\d)$"
          },
          "uniqueItems": true
        },
        "hostname": {
          "type": "string",
          "minLength": 1
        }
      }
    },
    "wanNetwork": {
      "type": "object",
      "additionalProperties": false,
      "required": [
        "interface",
        "mode"
      ],
      "properties": {
        "interface": {
          "type": "string",
          "minLength": 1
        },
        "mode": {
          "type": "string",
          "enum": [
            "dhcp",
            "static",
            "pppoe"
          ]
        },
        "address": {
          "oneOf": [
            {
              "type": "string",
              "pattern": "^(25[0-5]|2[0-4]\\d|[01]?\\d?\\d)\\.(25[0-5]|2[0-4]\\d|[01]?\\d?\\d)\\.(25[0-5]|2[0-4]\\d|[01]?\\d?\\d)\\.(25[0-5]|2[0-4]\\d|[01]?\\d?\\d)$"
            },
            {
              "type": "null"
            }
          ]
        },
        "prefixLength": {
          "oneOf": [
            {
              "type": "integer",
              "minimum": 1,
              "maximum": 32
            },
            {
              "type": "null"
            }
          ]
        },
        "gateway": {
          "oneOf": [
            {
              "type": "string",
              "pattern": "^(25[0-5]|2[0-4]\\d|[01]?\\d?\\d)\\.(25[0-5]|2[0-4]\\d|[01]?\\d?\\d)\\.(25[0-5]|2[0-4]\\d|[01]?\\d?\\d)\\.(25[0-5]|2[0-4]\\d|[01]?\\d?\\d)$"
            },
            {
              "type": "null"
            }
          ]
        },
        "dns": {
          "type": "array",
          "items": {
            "type": "string",
            "pattern": "^(25[0-5]|2[0-4]\\d|[01]?\\d?\\d)\\.(25[0-5]|2[0-4]\\d|[01]?\\d?\\d)\\.(25[0-5]|2[0-4]\\d|[01]?\\d?\\d)\\.(25[0-5]|2[0-4]\\d|[01]?\\d?\\d)$"
          },
          "uniqueItems": true
        },
        "pppoeUser": {
          "oneOf": [
            {
              "type": "string",
              "minLength": 1
            },
            {
              "type": "null"
            }
          ]
        }
      }
    },
    "networkPlan": {
      "type": "object",
      "additionalProperties": false,
      "required": [
        "management"
      ],
      "properties": {
        "management": {
          "$ref": "#/$defs/managementNetwork"
        },
        "wan": {
          "oneOf": [
            {
              "$ref": "#/$defs/wanNetwork"
            },
            {
              "type": "null"
            }
          ]
        }
      }
    },
    "nodeThinkPlan": {
      "type": "object",
      "additionalProperties": false,
      "required": [
        "enable"
      ],
      "properties": {
        "enable": {
          "type": "boolean"
        },
        "hostId": {
          "oneOf": [
            {
              "type": "string",
              "minLength": 1
            },
            {
              "type": "null"
            }
          ]
        }
      }
    }
  }
}
